ngoid,state,district,ngoname,orgemail,physicaladdress,officephone,orgtype,chairmanname
1, Andhra Pradesh ,Krishna,Sirisha Rehabilitation Centre,srcpamidi@yahoo.com,"Dno 3 /57, Veerankilock,Pamidimukkala(Md), Veerankilock - 521250", 9441-413161 ,"Vikaas,Disha Niramaya",M Immanuel
2, Andhra Pradesh ,Krishna,Kasinadhuni Durgamba Butchaiah Trust,kdbtrust_elakurru@yahoo.com,"3-74, Near S.F.U.P Schoolink Road, Elakurru - 521156", 9441-195424 ,"Disha,Vikaas",Kasinadhuni Nageswara Rao
3, Andhra Pradesh ,Godavari East,Uma Educational and Technical Society,umamanovikasakendram@gmail.com,"4 -54, Uma Manovikas Nagarvakala Pudi Panchayath, Near Ryudupalem, Kakinada, District-East Godavari - 533005", 9848-164779 ,"Badhte Kadam,Gharaunda Niramaya",S.P.Reddy
4, Andhra Pradesh ,Vishakhapatnam,Sreya Foundation,sreyafoundation@yahoo.co.in,"D.No.9-11-8/30, Sivajipalemopp Road Sivajipark Main Gate, Visakhapatnam - 530017", 9290-457978 ,"Samarth,Badhte Kadam,Vikaas,Disha",Dr. Usha Devi.P
5, Andhra Pradesh ,Guntur,Sri Dakshinya Bhava Samithi,dakshinya1995@yahoo.com,"Madhavi Nilayam, Swarna Bharathi Nagarj.K.C. College Road, New Rto Office, Guntur - 522006", 7702-977499 ,"Gharaunda,Samarth,Vikaas,Badhte Kadam",Dr. T. Venkateswara Rao
6, Andhra Pradesh ,Sri Potti Sriramulu Nellore,Vasantha Lakshmi Charitable Trust and Research Center,vasanthalakshmi1998@gmail.com,"16-11-131, Kasturi Devi Nagarpogathota, Nellore - 524001", 9000-114422 ,"Badhte Kadam,Vikaas,Disha",Smt. Dr. T. Vasantha Lakshmi
7, Andhra Pradesh ,Vishakhapatnam,The Ability People,theabilitypeople@gmail.com,"Door No. 49-27-10,, Sashi Raj Palace,Madhura Nagar, Near Sitammapet Jn., Visakhapatnam - 530016", 9177-363600 , Niramaya,Dilip Kumar Patro Una
8, Andhra Pradesh ,Krishna,Tadepallis Satya Sai Cheyutha Society,cheyutha36@gmail.com,"Plot-18,Road-3,Sector-4,, Lotus Land Markkedareswarapet, Vijayawada, Vijayawada - 520003", 9440-421781 ,"Disha,Vikaas,Badhte Kadam Niramaya",Dr.T.Krishna Kumari
9, Andhra Pradesh ,Srikakulam,Sunlight Educational Society,vijbhs@gmail.com,"Opp M I G 65, A P H B Colonynear Santhoshimatha Temple, Srikakulam - 532001", 9989-998602 ,Vikaas,B N R Sekhar
10, Andhra Pradesh ,Kurnool,Ambika Sishu Kendra A Unit Of Hemchand Devchand Charities Trust,askknl@yahoo.co.in,"44/86/C, Prakash Nagarprakash Nagar Auto Stand, Kurnool - 518004", 9395-520111 , Niramaya,Bindu N Shah
11, Andhra Pradesh ,Guntur,Awards Yuva Tech Authorised Computer Centre,awards1979@gmail.com,"9-20-1035/1, Syamalanagar, 1St Lanenear Old Railway Track, Guntur - 522006", 9182-877433 ,,P Venkata Rao
12, Andhra Pradesh ,Guntur,Prabhata Sindhuri Educational Society,prabhatasindhuri@gmail.com,"16-1-21, Ward No - 4, 3Rd Line Navabharat Nagarbesides Library, Guntur - 522006", 9392-227337 ,"Vikaas,Disha Niramaya",Vss Jayalakshmi Yamijala
13, Andhra Pradesh ,Godavari East,Santhivardhana Ministries,santhivardhana_ministries@yahoo.co.in,"4-152, Pulimeru Villagechadalada Post, Peddapuram Mandal, East Godavari District - 533433", 9177-899997 ,,R. Veerababu
14, Andhra Pradesh ,Chittoor,Velugu,velugu1mpl@yahoo.co.in,"12/2/A, Ammacheruvumitta, Kollabailukadiri Road, Madanapalle - 517325", 9440-585285 ,"Gharaunda,Disha",M Uday Mohan Reddy
15, Andhra Pradesh ,Krishna,Assisi Health Care Society,delcyputhenpurayil@gmail.com,"335C, Lakshmipuram Mainmilk Chilling Centre, Tiruvur - 521235", 9912-070844 ,Vikaas,Sr Elsy Thomas
16, Assam ,Kamrup Metro,Destination,anjal28@gmail.com,"59, Bhagaduttapur, Kahiliparanear Synergy Imperial, Guwahati - 781019", 9954-530985 ,,Rupa Hazarika
17, Assam ,Jorhat,Prerona Pratibandhi Sishu Bikash Kendra,prerona123@rediffmail.com,"17, P.O. Cinnamaradistrict -Jorhat, Assam - 785008", 9854-044474 ,"Disha,Samarth,Badhte Kadam Niramaya",Sayera Rahman
18, Assam ,Cachar,Deshbandhu Club,deshabandhuclub@rediffmail.com,"Behara Bazar, P.O. Behara Bazarbehara Bazar, Silchar - 788817", 9435-174392 ,Samarth Niramaya,Dr. Sanjib Sikidar
19, Assam ,Kamrup Metro,Shishu Sarothi Centre for Rehabilitation and Training for Multiple Disability,shishusarothi@gmail.com,"000, Ramakrishna Mission Roadopp To Tripura Bhawan, Guwahati - 781016", 9435-040607 ,,Ketaki Bardalai
20, Assam ,Kamrup Metro,Ashadeep,anjanagos@yahoo.co.in,"3B, Piya Apartment, Kanaklata Path,Near Big Bazar, Guwahati - 781007", 9864-077861 ,,Mr. Mukul Ch Goswami
21, Assam ,Nagaon,Gram Vikas Parishad,gramvikasparishad@gmail.com,"1, National Highway 36Rangaloo Wafa Enterprise, Nagaon - 782427", 9435-060538 ,,Samsheddin Ahmed
22, Assam ,Dibrugarh,Mrinaljyoti Rehabilitation Centre,mrinaljyoti@yahoo.co.in,"93, Duliajan, Kumudnagar Roadnear Kumdnagar Namghar, Duliajan - 786602", 9954-485197 ,Disha Niramaya,Mrs. Amiya Pathak Borpujari
23, Assam ,Sivasagar,Kaumudalaya,runjun.chutia1969@gmail.com,"7, Dubarani Alinear Sub Divisional Social Welfare Office, Sivasagar - 785640", 8638-074910 , Niramaya,Runjun Chutia
24, Assam ,Kamrup Metro,Sahayika Sishu Nirdeshan Kendra,utpalasharma@hotmail.com,"House No 3, Sahayika Sishu Nirdeshan Kendra,Govt Press Road, Bamunimaidam, Guwahati 781021Near Govt Press, Guwahati - 781021", 9435-192317 ,Disha,Subodh Sharma
25, Bihar ,Sitamarhi,Aarogyaa Foundation for Health Promotion and Community Based Rehabilitation,aarogyaafoundation@gmail.com,"Coat Bazar, Ward No 13Maharani Sthan, Sitamarhi - 843302", 9934-691872 ,"Badhte Kadam,Sahyogi,Disha,Vikaas",Dr Rajesh Kumar Suman
26, Bihar ,Patna,Child Concern,childconcernindia@gmail.com,"103, Sheela Complex, New Bahadurpur, Bazar Samiti Road, Rajendra Nagarshyam Mandir, Patna - 800016", 9934-977499 , Niramaya,Sulekha Kumari
27, Bihar ,Muzaffarpur,Baba Garibnath Viklang Sah Jan Seva Sansthan,babagarib1947@gmail.com,"Ward No 26, Kalambagh Roadhanuman Mandir, Muzaffarpur - 842001", 9334-498630 ,,Deepika Choudhary
28, Bihar ,Patna,Bihar Association Of Person With Disabilities,biharassociationofpwd@gmail.com,"Patel Colony, Sandalpur, Mahendru, Bahadurpurmahendru, Patna - 800006", 9386-208309 ,,Hirday Yadav
29, Bihar ,West Champaran,Tapovan Bahuviklang Punarvas Sansthan,info.tapovanbihar@gmail.com,"142, S.P Colony, Barwat Prasarain, Muffasil, Bettiahiti Road, Bettiah - 845438", 9852-167545 ,"Disha,Vikaas,Badhte Kadam Niramaya",Vikram Kumar Singh
30, Bihar ,Patna,Samarpan Special School for Autism Cp Mr Slow Learner Deaf and Learning Disabilities,samarpanindia100@gmail.com,"Samarpan, Illahibagh, New Bus Stand Bariya,Patna Gaya Road, West South Of Badshahi Pan, Po--Bariya, Patna - 800007", 7991-189522 , Niramaya,Santosh Kumar Sinha
31, Bihar ,Patna,Utkarsh Seva Sansthan,utkarshsevasansthan@gmail.com,"2H/77Bahadurpur Housing Colony, Mahatma Gandhi Nagar ,Kankarbagnear Bhootnath Road, Patna - 800026", 8294-370626 , Niramaya,Manisha Krishna
32, Bihar ,Gaya,Environmental Consultancy Vikash Centre,gsecovic@hotmail.com,"Ecovic, South Lakhibag, Manpur,Near Laxmi Narayan Mandir, Gaya - 823003", 9431-623779 ,,Vijay Kumar
33, Bihar ,Nalanda,Shri Arvind Foundaion,alok3722@gmail.com,"Nh-33, At-Ajnaura, Po-Ajnauranalanda Convent Iti, Bihar Sharif - 803114", 8789-173582 , Niramaya,Alok Kumar
34, Bihar ,Saharsa,Koshi Kshetriya Biklang Bidhwa Bridh Kalyan Samiti,koshibiklang1991@gmail.com,"D.B.Road, Saharsa, Behind Of Punjab National Banknear Of Rajdarbar Hotal, Saharsa - 852201", 6201-099468 ,"Disha,Samarth",Binay Bhushan Prasad
35, Bihar ,Patna,Umang Bal Vikas Awasiya Viklang Prashikshan Sansthan,umangbalvikas@gmail.com,"Fair Field Colony, Digha Ghatnear Ashadeep, Patna - 800011", 9470-732392 ,,Satish Kumar
36, Bihar ,Patna,Laxmi Smriti Sewa Sansthan,lsss_society@rediffmail.com,"H/O Sri Mithilesh Kumar Singh, Mithapur B Area Bengali Road Patnanear Hope Hospital, Patna - 800001", 9507-035981 ,Badhte Kadam,Dr Hemendu Kumar Singh
37, Bihar ,Muzaffarpur,Rani Laxmi Bai Mahila Vikas Samiti,saphal.muzaffarpur@gmail.com,"Saphal, Susta Railway Crossing, Ram Dayalu Nagaropposite Hotel Atithi, Muzaffarpur - 842002", 7294-156409 ,,Usha Manaki
38, Bihar ,Nalanda,Shama Vikas Samiti,shamavikassamiti@gmail.com,"13, Ansar Nagarmalahbigha, Islampur - 801303", 9431-664173 ,"Samarth,Badhte Kadam,Vikaas,Vikaas",Md Nizam Uddin Ansari
39, Bihar ,Patna,Aastha Charitable and Welfare Society,druma.shankarsinha@gmail.com,"Opp Pillar No-56 Near Machali Market, Raza Bazarmacchali Market, Patna - 800014", 9334-106629 ,"Badhte Kadam,Sahyogi,Disha,Vikaas",Dr Uma Shankar Sinha
40, Chandigarh ,Chandigarh,Indian National Portage Association,tehalkohli@gmail.com,"Room No. - 14-15, Karuna Sadan, Ist Floorroom No. - 14-15, Sector - 11 - B, Chandigarh - 160011", 9417-372091 ,Disha,Tehal Kohli
41, Chandigarh ,Chandigarh,National Association for the Blind Chandigarh and Punjab Branch,nabchd@yahoo.co.in,"Karuna Sadan, Room No. 6 7, Sector 11-B, Basement, Red Cross Society Buildingsector 11-B, Chandigarh - 160011", 9779-377377 ,Sahyogi,Vinod Chadha
42, Chandigarh ,Chandigarh,Umeed Society for Job Placement Of Mentally Challenged,umeedsociety31@gmail.com,"Umeed Society (H.O.), Griid, Aashadeep Building, Sector 31Near Police Station, Chandigarh - 160030", 9478-376936 ,,Dr. B.S Chavan
43, Chattisgarh ,Dhamtari,Shanti Maitri Gramin Vikas Sansthan,shanti.maitri.gvs@gmail.com,"C/O Manoj Kumar Sahu Ward No 10, Village And Post Darbadarba Kurud Dhamtari, Kurud - 493661", 8319-353001 ,"Samarth,Sahyogi,Badhte Kadam,Vikaas,Gharaunda",Manoj Kumar Sahu
44, Chattisgarh ,Raigarh,Unnayak Seva Samiti,ussrgh@gmail.com,"960/22, Behind Upbhokta Foramsecond Transformer Kelo Vihar Colony, Raigarh - 496001", 9827-976100 ,"Gharaunda,Disha,Samarth,Badhte Kadam",Sidhanta Shankar Mohanty
45, Chattisgarh ,Korba,Ankur Special School - Unit Of Ankur Korba,ankurkorba@gmail.com,"Hig-100, Hig-100,M.P.Nagar, Korba - 495681", 9826-134708 ,,Arundhati Kulkarni
46, Chattisgarh ,Korea,Robert Kanan Bala Smriti Sewa Sansthan,rkbsss2001@yahoo.in,"70, Chainpurbaikuntpur Road, Manendragarh - 497442", 8109-709730 ,,Sapna Choubey
47, Chattisgarh ,Raipur,Aakanksha Lions Institute Of Learning and Empowerment A Unit Of Lions Club Raipur Sewa Samiti,aakankshalsmh@yahoo.com,"Aakanksha Parisar, Avanti Viharnew Kachna Road, Raipur - 492001", 9826-845678 ,,Krishna Kumar Nayak
48, Chattisgarh ,Surguja,Anamika Welfare Society,anamika.welfaresociety07@gmail.com,"26, Deviganj Roadbehind Of Anamika Mobile, Ambikapur - 497001", 9926-134076 ,,Reeta Agrawal
49, Chattisgarh ,Kanker,Gundadhur Seva Shikshan Sanstha,gundadhur123@yahoo.com,"C-1,28/ 7Sector-7, New Rajendra Nagar Raipurnear Sai Ram Hospital, Raipur - 492001", 9201-457567 ,,Anil Chandel
50, Chattisgarh ,Gariya Band,Prerak Samiti,prerak.gbd@gmail.com,"Saksham , Rehabilitation Training Center For Person With Disability, Gariaband Road, Rajimnear Sindhouri Chowk, Rajim - 493885", 9424-218653 ,,Mr. R G Sinha
51, Chattisgarh ,Raipur,Samvedna Mansik Viklang Seva Sanstha,samvedna.smh@gmail.com,"52/509, Sundar Nagarholy Mother School, Raipur - 492013", 9302-090820 ,,Meena Sharma
52, Chattisgarh ,Bastar,Manovikas Special School Aghanpur Jagdalpur Bastar Dist run by Bastar Viklang Seva Samiti,manovikasjdp@gmail.com,"93, Chatrapati Shivaji Ward No 35, Aghanpurdharampura, Jagdalpur - 494001", 7748-012890 ,,Sr Betsy Thomas
53, Chattisgarh ,Raipur,Kopal Vani Child Welfare Organization,kopalvani@gmail.com,"06, Sahaj Marg, Sunder Nagarbehind Kps School, Raipur - 492013", 8871-415388 ,Disha,Kopal Vani Child Welfare Organization
54, Chattisgarh ,Bilaspur,Vikas Seva Sanstha Samalpuri Bilaspur,vssgarounda2000@gmail.com,"Domuhani, Garima Press Parisar Tilak Nagar Chantapara Bilaspur C.G.Behaind Chowkse Coledge Lal Khadan, Bilaspur - 495001", 9827-186959 ,,Smt. Anshu Gour
55, Goa ,North Goa,Disha Charitable Trust,disha.sare.ansh@gmail.com,"Disha Charitable Trust, 18 June Roadbehind Directorate Of Education, Panaji, Goa - 403001", 9822-980015 ,,Sandhya Kalokhe
56, Goa ,South Goa,Lokvishwas Pratishthan Special School,morearvind74@rediffmail.com,"6/3, Shantadurga Krupashramdhavali, Ponda - 403401", 9422-059580 ,,Shri. Anup S.S. Priolkar
57, Goa ,North Goa,Anand Niketan School for Differently Abled run by Aastha,anandniketangoa@gmail.com,"1, Ghateshwarnagar,Nr. Urban Health Centrekhorlim, Mapusa, Mapusa - 403507", 7499-461832 ,,Mr. Guruprasad Pawaskar
58, Goa ,North Goa,Sangath,contactus@sangath.in,"451/168, Bhatkar Vaddosocorro Porvorim, Porvorim - 403501", 9881-499458 ,,Ms. Monica Bariya
59, Goa ,North Goa,Sethu,reachus@sethu.in,"35, Defence Colony, Alto Porvorimdefence Colony, Porvorim - 403521", 7720-013749 ,"Badhte Kadam,Badhte Kadam,Sahyogi,Badhte Kadam,Badhte Kadam,Sahyogi,Sahyogi,Sahyogi,Badhte Kadam,Badhte Kadam,Badhte Kadam,Sahyogi,Sahyogi,Badhte Kadam,Badhte Kadam",Dr. Nandita De Souza
60, Gujarat ,Valsad,Manovikas Charitable Trust,mohanbdeo59@gmail.com,"Manovikas Charitable Trust, Degam Vapih B Primary School, Vapi - 396191", 8141-814494 , Niramaya,Dr. Mohan B. Deo
61, Gujarat ,Surendranagar,Ashirwad Viklang Trust,atfd.sayla@yahoo.in,"4, B/H, Police Stationnational Highway, Sayla, Dist. Surendranagar - 363430", 9328-950340 ,"Badhte Kadam,Disha,Vikaas Niramaya",R.S.Jadav
62, Gujarat ,Ahmedabad,Shah Jaswantlal Jiwanlal Charitable Trust,jjctrehab@gmail.com,"301,302,303 Aagam Complex, Apmc Market Roadb/S Vasna Police Station, Vasna, Ahmedabad - 380051", 9825-877370 ,,Yashesh Shah
63, Gujarat ,Junagadh,Samprat Education and Charitable Trust-Junagarh,samprat.jnd@gmail.com,"410, To. Dungarpurbilkharod, Opp. Near Nandkisor Narsy,, Vijapur Street,Dist. Junagadh, Ta. Junagadh. - 362263", 9913-236691 ,"Disha,Samarth,Vikaas,Badhte Kadam Niramaya",Parmar Mahendrabhai Jashabhai
64, Gujarat ,Rajkot,The Society for the Mentally Retarded,mentally@rediffmail.com,"Opp B T Savani Kidney Hospital, University Roadnera Snk School, Rajkot - 360005", 9825-218252 ,,Hitesh N Kanabar
65, Gujarat ,Ahmedabad,National Society for Equal Opportunities for the Handicapped Gujarat,naseohgujarat@gmail.com,"Naseoh (Gujarat), Besides Navrangpura Bus Standopp. Navrangpura Post-Office, Ahmedabad - 380009", 9825-027701 ,,Maulesh Shah
66, Gujarat ,Bhavnagar,Ankur Special School for Mentally Retarded Children,ankurmrschool.bvn@gmail.com,"Plot No. 1945, Near Working Womens Hostelsardarnagar Circle, Bhavnagar - 364002", 9925-537878 ,Vikaas Niramaya,Alpeshbhai K Sheth
67, Gujarat ,Surat,Mavjat Parents Association Of Mentally Challenged Persons and Charitable Trust,mavjat@gmail.com,"22 Sugam Society ,, Adajan Patiyarander Road, Surat, Surat - 396009", 9824-959644 , Niramaya,Nilesh R Vyash
68, Gujarat ,Bhavnagar,Smt. Parsanben Narandas Ramji Shah(Talajawala) Society for Relief Rehabilitation Of the Disabled,pnrsociety.cpschool@gmail.com,"Nataraj Research Center And Training College Campus, Nr. Sardar Patel School, ,Kaliyabid, Bhavnagar - 364002", 9327-543757 ,"Vikaas,Disha,Badhte Kadam,Sahyogi Niramaya",Paras C Shah
69, Gujarat ,Gir Somnath,Jeevandeep Health Education and Charitable Trust Kodinar,jeevandeepkodinar@gmail.com,"24-25, At. Gohil Ni Khan (Og Area) , Jeevandeepnear Chorwadi Mandir, Bypass Road, Kodinar, Kodinar - 362725", 9898-320881 ,"Disha,Vikaas,Badhte Kadam Niramaya",Sidik Chavda
70, Gujarat ,Navsari,Manav Kalyan Trust Navsari Gujarat,manavkalyantrust@yahoo.co.in,"C.L.Parikh Mamta Mandir Maheshbhai Kothari Marg, At Po - Vijalporeta. Jalalpore, Navsari - 396450", 9712-283860 ,,Viratkumar Pravinchandra Kothari
71, Gujarat ,Ahmedabad,Blind Peoples Association (India),mihirjgd@gmail.com,"Andhjan Mandal, 132 Ring Road, Opp. Iima, Vastrapur, Ahmedbadjagdish Chowk,, Ahmedabad - 380015", 9825-014210 ,"Disha,Badhte Kadam,Sahyogi Niramaya",Dr. Bhushan Punani
72, Gujarat ,Rajkot,Prayas Parents Association for Children With Special Needs,infoprayasassociation3605@gmail.com,"School No. 69 Old Building, Ambaji Kadva Plot No - 2Krishnanagar Main Road, Rajkot - 360004", 8128-138092 ,,Pooja Sureshbhai Patel
73, Gujarat ,Valsad,Jaina Anupam N Parmar Charitable Trust,jainaanupam@gmail.com,"Jaina Anupam N Parmar Charitable Trust, Kailash Roadnr. Kailash Owara High School, Valsad - 396001", 9409-419251 ,,Dr. Chetanaben Davada
74, Gujarat ,Dahodd,Blind Welfare Council,bwcdahod@gmail.com,"695/1, Mandaav Roadopp. - Panchmukhi Hanuman Temple, P.O. Box - 115, Dahod - 389151", 9429-146152 ,"Disha,Vikaas Niramaya",Yusufi F Kapadiya
75, Gujarat ,Gandhinagar,Sadhna-parents Association for Mentally Challenged Persons,bprasad1655@yahoo.com,"Plot No. 106/2,, Sector-3/A,Nr. Ambaji Temple, Gandhinagar - 382006", 9898-594350 , Niramaya,Gangarambhai K. Patel
76, Gujarat ,Surat,Universal Welfare Trust Of India,universalwelfare@yahoo.com,"Rampara Kharvasa Road, Nr Punchmukhi Hanumanji Templebardoli, Bardoli - 394601", 9825-141545 , Niramaya,Kishor Mohanlal Solanki
77, Gujarat ,Ahmedabad,Self Care,selfcare2009@gmail.com,"Shop No, Gf-6, Shop No, Gf-6, Ayana Complex Opp Suvarnavilla Bunglows,100 Ft Thaltej-Hebatpur, Thaltejnear Shell Petrol Pump, Ahmedabad - 380059", 9898-066390 , Niramaya,Juhi Paresh Kishnani
78, Gujarat ,Ahmedabad,Navjeevan Charitable Trust,nileshnavjeevan@gmail.com,"Survey No. 5, Thakor Vas,, Nr,Shiv Mandir Memnagar Gamb/H Jogni Temple Gully,Memnagar, Ahmedabad - 380052", 9824-263608 ,,Dr. Subhash Apte
79, Gujarat ,Morbi,Shree Navjivan Viklang Sevashray,navjeevan.joshy@gmail.com,"Opp.220 K.V Substation, Gidc Areahalvad, Halvad - 363330", 9558-965101 ,,Jitendra G Joshi
80, Gujarat ,Ahmedabad,Bharat Lokhit Seva Samiti,contact@chinmayindia.org,"1/B-2/A, Azadnagar, Nr.Rishikesh Vidhyalayanavi Fatehwadi, Sarkhej, Ahmedabad - 382210", 9898-148297 ,,Dr. Garga Bhogilal Shukla
81, Gujarat ,Vadodara,Disha Charitable Trust,dishaschoolbaroda@gmail.com,"62, Sampatrao Colony, Opp. Circuit Housealkapuri, Vadodara - 390005", 9227-108880 ,,Mr. Naresh Chawla
82, Gujarat ,Ahmedabad,Omkar Foundation Trust,omkarfoundationtrust@gmail.com,"56, H. A. Marketnr. Railway Station, Ahmedabad - 380002", 9879-048757 ,Badhte Kadam,Kinjal Ashokkumar Shah
83, Gujarat ,Rajkot,Aekrang Childrens Development Institute,aekrang.institute@gmail.com,"53, Street No. 4Vishwakarma Society, Sadhuvasvani Road, Rajkot - 360005", 9137-690064 , Niramaya,Deepika Prajapati
84, Gujarat ,Ahmedabad,Aastha Charitable Trust for Welfare Of the Mentally Challenged,ananddham2016@gmail.com,"Village - Adroda, Ta: Bavlaopp: Kings Villa, Bavla - 382220", 7698-677110 ,,Nitesh Solanki
85, Gujarat ,Bharuch,Asmita Vikas Kendra,asmitavikaskendratralsa@gmail.com,"1, Nabupur- Dayadra Roadtralsa, Bharuch - 392020", 9427-117178 ,,Yashwantbhai M Patel
86, Gujarat ,Sabarkantha (Himmatnagar),Sabarkantha Charitable Trust Sanchalit Institution for Mentally Retarded Children,mr21hmt@gmail.com,"Nr Adari Ciramics Plot 12, B H Krishna Hotelhimatnagar (M), Himmatnagar - 383001", 9998-828975 , Niramaya,Kunjbiharibhai Jashbhai Patel
87, Gujarat ,Vadodara,Medical Care Centre Trust,hasmukhrathawa78@gmail.com,"K.G. Patel Children Hospital, Jalaram Marg,Karelibaug,, Vadodara - 390018", 8140-073278 , Niramaya,Dr. Jagdish Patel
88, Gujarat ,Kachchh-Bhuj,Shri Navchetan Andhjan Mandal,info@navchetan.org,"Viklang Vidya Vihar, Bhuj Anjar Highwayopp.- Mother Dairy, Madhapar, Taluka- Bhuj Dist- Kuchchh - 370020", 9825-226598 ,,Laljibhai Prajapati
89, Gujarat ,Ahmedabad,Health & Care Foundation,poliofoundation@gmail.com,"Indukaka Ipco Wala Seva Sansthan, Pavansut Socity, Opp.Rajwadu Hoteljivraj Park, Ahmedabad - 380051", 9825-349108 , Niramaya,Dr.Prakash Bhatt
90, Gujarat ,Mahesana,"Khodiyar Education Trust, Mehsana",khodiyareducationtrust@yahoo.in,"1/23, Panjarapol Building,Near Azad Chok,, Mehsana (Gujarat) - 384001", 9825-199379 ,"Disha,Badhte Kadam Niramaya",Vishnubhai M. Chaudhary
91, Haryana ,Hisar,Dot Army Wives Welfare Association Asha School,ashahisar@gmail.com,"4 Mech Inf (1 Sikh), Military Station Hisar, Hisar Cantt. - 125006", 8059-391041 , Niramaya,Mrs Sharmil Nagar
92, Haryana ,Karnal,Tapan Rehabilitation Society,sujatavspk@yahoo.com,"Tapan Rehabilitation Society,, Pragya Institute For Education Training Of Disabledg T Road, Near Police Post, Nilokheri ,, Karnal - 132117", 9416-191483 ,"Disha,Sahyogi,Badhte Kadam Niramaya",Dr. Sujata
93, Haryana ,Kurukshetra,Society for Education and Empowerment Of Disadvantage,seedkurukshetra@gmail.com,"Kheri Markanda, Khedimarkanda, Partapgarh Road, Kurukshetra, Haryana, India, 136118Haryana, Kurukshetra - 136118", 9812-089840 ,,Jai Prakash Keshari
94, Haryana ,Bhiwani,Adarsh Para Medical Welfare Association,adarshmitc@gmail.com,"Na, Uttam Nagar, Loharu Roadnear Chara Mandi,, Bhiwani(Hry.) - 127021", 9729-080045 ,"Vikaas,Badhte Kadam,Sahyogi",Dr.Rajesh Kumar
95, Haryana ,Faridabad,Tender Heart Education Society,tenderheartngo@yahoo.com,"695, Sector 28, Faridabad - 121003", 9350-844393 , Niramaya,Renu Bali
96, Haryana ,Yamunanagar,Aarohan Welfare Society,aarohanwelsoc@gmail.com,"132, Professor Colony Opp Dav Physiotherapy College, Yamuna Nagar - 135001", 9355-370656 , Niramaya,Dr Ritu Soni
97, Haryana ,Jind,Darpan Communication Society,darpanjind@gmail.com,"881/18, Shiv Colony,Jind, Jind - 126102", 8607-855300 ,,Shri Bhagwan Rana
98, Haryana ,Rewari,Nav Prerna,navprerna3441@yahoo.com,"Sh Ganeshi Lal Goyal Dharmshala, Radha Swami Colony, Sector3Near Gymkhana Club, Rewari - 123404", 9812-160556 ,Vikaas,Harish Malik
99, Haryana ,Gurgaon,"Vishwas,vision for Health Welfare Special Needs",admn.vishwas@gmail.com,"Vishwas Vision For Health Welfare And Special Needs, Sector-46, Arya Samaj Roadnear Unitech Cyber Park, Gurgaon - 122002", 8178-047774 , Niramaya,Neelam Jolly
100, Haryana ,Gurgaon,Khushboo Welfare Society,khushboowelfaresociety@gmail.com,"02, Sector-10Anear Lions Public School, Gurgaon - 122001", 9971-698963 ,,Vijay Pal
101, Haryana ,Ambala,Novelty Education Society,pgambhir2001@gmail.com,"Novelty Complex, #5173-74, Noverlty Complexbazaza Bazar, Ambala Cantt. - 133001", 9416-394173 , Niramaya,Satya Pal
102, Himachal Pradesh ,Mandi,Sahyog Bal Shravan Viklang Kalyan Samiti,nksharma52@yahoo.com,"244/7, National Street, Near Pnb Moti Bazar, Mandi - 175001", 9418-023539 ,,Narender Kumar Sharma
103, Himachal Pradesh ,Kangra,Cord (Chinmaya Organisation for Rural Development),cordsidhbari@gmail.com,"9/1, Village And Post Office Sidhbaritehsil Dharmashala, Dharamsala - 176057", 9816-655592 , Niramaya,Dr. Kshama Metre
104, Himachal Pradesh ,Una,Prem Ashram Institute Of Sisters Of Charity,vincyalex009@gmail.com,"000, Takka Roadnear Hrtc Workshop, Una - 174303", 7831-014330 ,,Jibin Mol V.V
105, Himachal Pradesh ,Solan,Ganpati Educational Society,sharma.roshan@yahoo.co.in,"...., Near Telephone Exchangetelephone Exchange, Kunihar - 173207", 9418-079043 ,"Vikaas,Disha,Sahyogi",Roshan Lal Sharma
106, Himachal Pradesh ,Mandi,Sakar Society for Differently Abled Persons,sakarsociety@yahoo.in,"Vil- Dohwan,, Sunder Nagarmandi, Himachal Pradesh - 175002", 9816-018605 ,"Disha,Vikaas",Sheetal Sharma
107, Himachal Pradesh ,Hamirpur,Pehchan Education Society,pehchan.hmr@gmail.com,"Vill. Chunal, Jhaniaranear Central School, Hamirpur - 177001", 7018-512743 ,,Chetna Sharma
108, Himachal Pradesh ,Sirmaur,Aastha Welfare Society,aasthanahan@gmail.com,"Aastha Welfare Society, Pucca Tanknear Panchayat Bhawan, Nahan - 173001", 9418-035001 ,,Rajeev Bhandari
109, Himachal Pradesh ,Shimla,Udaan Parents and Guardians Society Of Mentally Challenged Children,udaanhp@gmail.com,"B-16, Sector- 2,,, New Shimlanear Community Center, Shimla - 171009", 9418-395095 ,Vikaas,Madhuri Sood
110, Himachal Pradesh ,Una,Human Rights Protection Cell and Welfare Association Ashhraya Siddyana Tobba Lower Dehlan Distt Una,ashhraya@gmail.com,"Sadyana Tobba, Dehlan Bedharer Roadcommunity Centre, Lower Dehlan - 174306", 9736-980666 ,,Suresh Kumar
111, Jharkhand ,Ranchi,"Deepshikha, Institute for Child Development and Mental Health(A Unit Of Purshree)",deepshikhainfo@gmail.com,"Arya Samaj Mandir, Swami Shradhanand Roadupper Bazar Ranchi, Jharkhand - 834001", 9334-423789 ,Badhte Kadam Niramaya,Sudha Lhila
112, Jharkhand ,Dhanbad,Pahela Kadam Special School run by Narayani Charitable Trust,narayanicharitabletrust@gmail.com,"8, Saraidhela Roadnear Saraidhela Police Thana, Dhanbad - 826003", 9471-162439 , Niramaya,Smt. Anita Agarwal
113, Jharkhand ,Deoghar,Srijak Samuh,srijaksamuh@gmail.com,"Srijak Samuh, Williams Townrani Kothi, B. Deoghar,, Deoghar - 814112", 9431-063699 ,,Umashankar Kumar
114, Jharkhand ,Hazaribagh,Samajik Samasya Niwaran Ewam Kalyan Sansthan,ssneks@gmail.com,"300, Forest Colony, Hurhurunear Cemetery Gate, Hazaribag - 825301", 9431-796018 ,,Manish Kumar Sinha
115, Jharkhand ,Ranchi,Child Concern,childconcern.jharkhand@gmail.com,"1B, Shubh Gauri Enclave, Budh Vihar Colony,, Argora Bypass, Ashok Nagar, Harmu, Ranchiargora Bypass, Ranchi - 834002", 9472-162409 ,Badhte Kadam,Sugandh Narayan Prasad
116, Jharkhand ,Ranchi,Jharkhand Parent Association,koshishparent@gmail.com,"H-70, Argora Housing Colony, Ranchinear Argora Chaowk, Ranchi - 834002", 9934-523571 ,,Deepa Choudhary
117, Jharkhand ,Ramgarh,Bhawishya Kiran,jha_sanjeev1972@rediffmail.com,"Qno-B/6, Rescue Bhawan Colony, Naisarainear Damoder Pull, Ramgarh - 829122", 9431-535390 ,,Mala Jha
118, Jharkhand ,East Singhbhum,Parents Association Of Mentally Handicapped Of Jamshedpur,pamhj361@gmail.com,"Lions Club Of Jamshedpur Artificial Limb Fitting Centre(Lalfic), Sonarinear Carmel Junior College/Bal Vihar, Jamshedpur - 831011", 9431-372214 ,Prerna,P Babu Rao
119, Jharkhand ,Dhanbad,Jeevan,jeevan_ak@yahoo.co.in,"Jeevan, Bastacolla, Gaushallamoredhansar, Dhanbad, Dhanbad - 828106", 9934-352294 ,"Vikaas,Samarth,Badhte Kadam,Sahyogi",Anil Kumar Singh
120, Karnataka ,Bangalore Urban,Baldwin Opportunity School Of Baldwin Methodist Educational Society,baldwinoppschool@hotmail.com,"No.3,, 3, Rhenius Street, Richmond Townrichmond Town, Bangalore - 560025", 9845-389740 ,,Sajinie Gnanatheeban
121, Karnataka ,Devangere ,Spoorthy Organization for Education and Social Development,spoorthy.hnl@gmail.com,"Spoorthy, Urdu Schoolnear Urdu School, Nallur - 577221", 9448-976910 ,Disha,K B Roopa Naik
