ngoid,state,district,ngoname,orgemail,physicaladdress,officephone,orgtype,chairmanname
242, Maharashtra ,Mumbai City,Jai Vakeel Foundation Research Centre.,snacmaharashtra@gmail.com,"Sewri Hill, Abhyudaya Nagar Chs, Kalachaowki, Sewri Roadnear Milan Industrial Estate, Sewri - 400033", 9321-330311 ,Badhte Kadam,Ms. Archana Chandra
243, Maharashtra ,Mumbai City,Cerebral Palsy Association Of India,hhw.multiplehandicapped@gmail.com,"Windsor Bmc Library Building, Windsor Lane, Cst Road, Kalina, Santacruz (East),Opposite Jp Morgan, Mumbai - 400098", 9029-882662 ,,Manjusha Singh
244, Maharashtra ,Nagpur,Rashtramata Bahu Uddeshiya Shikshan Mandals Running Special Schools for Person With Disability,ank2you@gmail.com,"S-1 Krishna Regency, Sampriti Nagarnear Power Grid, Nagpur - 440026", 7385-114111 ,,Sanket Raj Kaspe
245, Maharashtra ,Raigad,Sumangal School for Mentally Challenged Children run by Suhit Jeevan Trust,suhitjeevantrust@gmail.com,"Suhit Jeevan Trust, Damodar Nagar,, Chinchpada, Pendr. Mahajans Hospital, Pen - 402107", 9892-191918 ,,Dr. Surekha Patil
246, Maharashtra ,Kolhapur,Lt. Ganpatrao Gatade Special School run by Kagal Taluka Kala Krida Shaikshanik Sanskrutik Mandal,atulramchandrajoshi@gmail.com,"153, Koshti Gallishraddha Nivas, A Ward, Kagal - 416216", 9822-009596 ,,Atul Ramchandra Josh
247, Maharashtra ,Mumbai Suburban,Organization for Autistic Individuals,itsoai2012@gmail.com,"Flat No A 805 By 806 Meghdoot Bldg, Lokhandwala Back Roadopposite Jogging Track, Andheri West Mumbai - 400053", 9820-180198 ,,Devopam Narendra Bajpai
248, Maharashtra ,Ahmednagar,Matimand Vikas Shikshan Mandal,matishala@rediffmail.com,"Wadia Park, Tilak Roadahmednagar, Ahmednagar - 414001", 9850-901709 ,,Dr.Ravindra Ramchandra Satalkar
249, Maharashtra ,Aurangabad,Vihang Vishesh Mulanchi Shala run by Savitribai Phule Mahila Ekatma Samaj Mandal,vihang611@gmail.com,"Gat No-44, Uma Gopal Nagarnear Kamal Nayan Bajaj Hospital, Beed Bypass, Aurangabd - 431010", 9921-750424 ,,Dr. Vitthal M. Kulkarni
250, Maharashtra ,Mumbai Suburban,Holistic Child Care Centre and Special School run by M.B. Barvalia Foundation,spandan.office@gmail.com,"Spandan Holistic Mother And Childcare Hospital,, Near Deonar Fire Brigade, Municipal Colonynear Sai Baba Temple, Deonar,Govandi, Mumbai - 400043", 9324-404197 ,"Disha,Disha,Gharaunda,Gharaunda,Gharaunda,Disha,Disha",Dr Praful Barvalia
251, Maharashtra ,Pune,Kamayani Prashikshan and Sanshodhan Society Kamayani School for the Mentally Handicapped Pune,kamayaniudyogkendrapune16@gmail.com,"270 / B Gokhalenagar Pune, Balshatri Jambhekar Roadnear Patrakar Nagar Society Opp Baramati Hostel, Pune - 411016", 2025-651588 ,,Dr Ashutosh Bhupatkar
252, Maharashtra ,Thane,Association Of Parents Of Mentally Retarded Children,vishwasgore1960@hotmail.com,"5A/14, Pareira Nagar, Khopat, Agra Roadbehind Central Bus Stand, Thane, Thane - 400601", 9821-054369 ,,Mr. Vishwas M. Gore
253, Maharashtra ,Osmanabad,"Tuljai Pratishthan Bahuuddeshiya Sansta Pangaon, Sanchalit Swaadhar Matimand Mulinche Balgruh ,Osman",chavansn5@gmail.com,"Tuljai Pratishthan, Swadhar Home For Mentally Challenged Girlsair Port Road Near Gapat Farm Alani Tq Dist Osmanabad, Osmanabad - 413501", 9423-767524 ,,Shahaji Narayan Chavan
254, Maharashtra ,Nagpur,Jeevoday Special School for Mentally Retarded A Unit Of Jeevoday Education Society,jeevodaynagpur@ymail.com,"25/B, Residancy Roadsfs School, Nagpur - 440001", 9890-279110 , Niramaya,Sr Josna Mary
255, Maharashtra ,Dhule,"Shri Sanskar Matimand Mulinche Balgruh (Yamunai Shaikshanik V Sanskrutik Mahila Mandal,Dhule)",yamunaidhule@gmail.com,"Gat No 9, Sakri Roadbalaji Nagar, Morane Pra La,, Dhule - 424001", 8698-608777 ,,Mangalabai Sunil Wagh
256, Maharashtra ,Satara,Ehsaas Matimand Mulanche Balgruh run by Chandrakant Bhanji Chande Memorial Trust,ehsaasmrchild@rediffmail.com,"At/P Valse Tal/Dist Satara, Nh4 Mega Highwaynear Ajinkyatara Sugar Factory, Shendre, Satara - 415519", 9823-773901 , Niramaya,Siddharth Arvind Thakkar
257, Maharashtra ,Pune,Umed Pariwar,info@umedpariwar.org,"Gat No. 949, Hadapsar Saswad Roadkanifnath Paytha, Wadki, Wadki Village - 412308", 9890-092958 ,,Purushottam Gopilal Sharma
258, Maharashtra ,Mumbai Suburban,Parivaar Sahyadri the Apex Council Of Parents Of Persons With Intellectual and Developmental Disabilities,parivaarsahyadri@gmail.com,"A 301 Shivashish, S V Road Andheri Westopp Shoppers Stop, Mumbai - 400058", 9920-447481 , Niramaya,Prakash Bhalgat
259, Maharashtra ,Nashik,"National Association for the Blind, Unit Maharashtra",nabdeafblind.86@rediffmail.com,"National Association For The Blind, Unit Maharashtra, Nab Sankul, Plot No. P-66,Lane No.3, Street A, Midc, Satpur, Nashik - 422007", 8975-725562 , Niramaya,Mr. Rameshwar Kalantri
260, Maharashtra ,Ratnagiri,Aavishkar Society for Dev Of Mentally Handicaped Children,aavishkar.ratnagiri@gmail.com,"E-95, M.I.D.C.Mirjole, Ratnagiri - 415639", 9422-430893 ,,Shri. Bipin Rasikalal Shaha
261, Maharashtra ,Latur,Sanvedana Cerebral Palsy Vikasan Kendra run by Rss Janakalyan Samiti,sanvedana.cpvkl@gmail.com,"Sanvedana Cerebral Palsy Vikasan Kendra, Lakshmi Nagar, Barad Vastiharangul Bk Tq.Dist Latur, Latur - 413531", 9422-072517 ,Gharaunda Niramaya,Mr Suresh Manoharrao Patil
262, Maharashtra ,Thane,Astitva Matimand Mulanchi Shala run by Astitva Prahladrai Kagazi Institute for Hanidcapped,astitvatrust81@gmail.com,"Plot No8 Phase 1, Midcnear Lic Office, Dombivli - 421203", 9820-043631 ,,Radhika Milind Gupte
263, Maharashtra ,Latur,Shri Gajanan Bahuddeshiy Sanstha Bori Sanchalit . Sant Gadgebaba Anath Matimand Mulanche Balgruha,sgbammblatur@gmail.com,"Sant Gadgebaba Anath Matimand Mulanche Balgruha, Latur, In Front Of Avishkar Society, Babhalgaon Roadnear Kazi Petrol Pump, Latur - 413512", 9422-342731 ,,Shila Annasaheb Kadam
264, Maharashtra ,Ahmednagar,Matimand Mulanche Balgruha run by Navoday Gramin Nagari Vikas Prati. and Sancrutik Mandal Pathardi,navodaypathardi@gmail.com,"Survey No. 104/3 And 104/4, Mohari Roadnear Stone Crusher, Pathardi - 414102", 9850-652929 ,,Smt. Anita Ashok Nirhali
265, Manipur ,Imphal West,Handicapped Development Foundation,hdfoundationmanipur@gmail.com,"57, Sagolband Tera Pukhri Mapalimphal West, Imphal - 795001", 9612-157246 ,Disha Niramaya,Dr. Sapam Jasowanta Singh
266, Manipur ,Imphal West,Relief Centre for the Welfare Of Differently Abled Persons Manipur,reliefcentremanipur@gmail.com,"32, Singjamei Chingamathak Pishumnear Hao Ground, Imphal - 795008", 9862-275037 ,Badhte Kadam,Ch Lokeshori Devi
267, Manipur ,Churachandpur,The Malsawm Initiative run by Centre for Community Initiative,pauzagin@communityinitiative.in,"Nehru Marg, Central Lamkaopp Chingkangpa Avenue, Churachandpur - 795128", 9612-153082 ,Disha,Mr Pauzagin Tonsing
268, Manipur ,Imphal East,Bliss Island School run by People Advanced In Social Services (Pass),pass.imp@rediffmail.com,"2Nd Street, Phaikhothang Village, Near Khuga Dam,Saikot Sub Division, Churachandpur, Churachandpur - 795006", 9862-133392 ,"Badhte Kadam,Samarth,Disha,Gharaunda Niramaya",Henthianlun
269, Meghalaya ,East Khasi Hills,Bethany Society,bethanyngo1981@gmail.com,"Bethany Society, Lady Veronica Lane Laitumkhrahopposite Bansara Eye Care, Shillong - 793003", 9436-119808 ,Disha Niramaya,Carmo Noronha
270, Odisha ,Khordha,Dr. Braja Vihari Mohanty Memorial Mentally Retarded Benefit Trust,jagrutibbsr@gmail.com,"Plot No 430 Part, , Santinagar, Jharapara,Near Ganesh Mandir, Orissa - 751006", 9437-075921 ,Gharaunda,Baikuntha Bihari Mohanty
271, Odisha ,Puri,Pingalakhi Public Welfare Organisation,pingalakhi@gmail.com,"At-Jayashree Square, Po-Nimaparanear Bank Of India, Nimapara - 752106", 9438-090331 , Niramaya,Rajkishor Sabut
272, Odisha ,Puri,Nilachal Seva Pratisthan,nspodisha@gmail.com,"Benagaon, Dayavihar, Kanasbesides River Daya, Kanas - 752017", 9438-018582 ,"Gharaunda,Samarth",Subas Chandra Gajendra
273, Odisha ,Dhenkanal,Participatory and Reconstruction Institute Action,priajaj@gmail.com,"At/Po-Laulai,Via-Gondia, Laulai Gondianear Tank, Dhenkanal - 759016", 9937-300982 , Niramaya,Tankadhar Barik
274, Odisha ,Bhadrak,Centre for Rehabilitation Services Research Crsr,crsrodisha@gmail.com,"Prasanti Bhawan, Dahanigadia, Po: Charampaback Side Of Old Dalda Factory, Bhadrak - 756101", 9692-165555 ,"Samarth,Gharaunda,Vikaas,Sahyogi,Badhte Kadam",Er. Bhagaban Parida
275, Odisha ,Kandhamal,National Institute for Peoples Development Investigation and Training,nipdit28@gmail.com,"Nipdit, Lengar Sahi, College Road, Phulbaninear Govt, Autonomous College, Phulbani, Phulbani - 762001", 9437-112246 ,,Rama Chandra Dash
276, Odisha ,Mayurbhanj,Rural Organisation for Social Elevation,roseorg2009@gmail.com,"Raghunathpur, Raghunathpurnear Dargadhei Golei, Baripada - 757107", 9437-218266 ,Samarth,Chandan Das
277, Odisha ,Kendujhar,Sadbhabana,sadbhabanakeonjhar@gmail.com,"Naranpur, Naranpurprayas Special School,Near Weekly Hata Field,Naranpur, Kendujhar - 758014", 9337-646108 ,Gharaunda,Chandi Prasad Pattanaik
278, Odisha ,Khordha,Centre for Autism Therapy Counselling and Help (Catch),catch2003@gmail.com,"Plot No.-26, 26, Madhusudan Nagarunit-4, Bhubaneshwar, Khorda - 751001", 9937-004040 ,,Reeta Jena
279, Odisha ,Mayurbhanj,Manovikas Society for Differently Abled Children,manovikas_baripada@yahoo.com,"03, Betnarajabadi, Raikadjharan,Takatpur, Baripada - 757003", 8917-535964 ,,Sr Tesina
280, Odisha ,Angul,Shivanginee Institute Of Child Development,sicdodisha@gmail.com,"11, Lucky Type Chhaka, Hakimpadanear Govt. College, Angul - 759143", 8249-506323 ,,Sujata Chaulia
281, Odisha ,Khordha,"Institute Of Health Sciences, A Unit Of Margdarsi",snacodisha@gmail.com,"N2/41, Irc Villageirc Village,Nayapalli, Bhubneshwar, Bhubaneswar - 751015", 9437-005096 ,"Badhte Kadam,Vikaas,Samarth",Satyanarayan Mahapatra
282, Odisha ,Cuttack,The Hope,sanjaysazzan@gmail.com,"1802/3027, Mangalabagmedical Road, Cuttack - 753001", 9437-196408 ,Badhte Kadam Niramaya,Dr. Sanjay Kumar Sazzan
283, Odisha ,Jharsuguda,Ashakiran Charitable Society,kiranasha830@gmail.com,"019/999, Jharsugudadipu Pada, Jharsuguda - 768201", 9438-157469 ,,Sr. Kripa Poul
284, Odisha ,Ganjam,Ganjam District Orthopaedically Handicapped Welfare Association,samartha_gdohwa@yahoo.co.in,"110/15, Netaji Subash Marg (Near Sp Residence)Infront Of Bharat Petrol Pump, Chatrapur - 761020", 9437-049457 ,,K Ananda
285, Odisha ,Balangir,Association for Social Help In Rural Area,ashraorissa2007@rediffmail.com,"A73, Tusrajagannath Temple, Balangir - 767030", 9437-916866 ,"Sahyogi,Samarth,Gharaunda",Ranjit Prasad Mohanty
286, Odisha ,Sundargarh,Hope,dalvindersi@gmail.com,"Subash Bose Hospital, Rajgangpursubash Chowk, Rajgangpur - 770017", 9437-040576 ,,Dr. Dalvinder Singh Bhangu
287, Odisha ,Sonepur,Juba Jyoti Jubak Sangha,jubajyoti@gmail.com,"34, 37,, Saradeipur, Dhauli Square, Dist-Khurdaopposite To Gayatri Science College, Bhubaneswar - 751002", 9437-153132 ,,Chandeswar Jayasingh
288, Odisha ,Sundargarh,Shradha,shraddha.rkl@gmail.com,"C/317, Sector-16Near Community Centre, Sec-16, Rourkela - 769003", 9438-187899 ,,Kartik Chandra Pandab
289, Odisha ,Sonepur,Research Academy for Rural Enrichment (Rare),raresonepur@hotmail.com,"00, P.O.- Sonepur, Sonepur - 767017", 9937-618884 ,"Disha,Badhte Kadam,Vikaas,Disha,Sahyogi Niramaya",Mr. Ananga Negi
290, Odisha ,Balasore,The Welfare,blindschoolbalasore@gmail.com,"Ward -22, Ranipatna, P.O. /Dist. Balasoredaraji Pokhari Chhak, Balasore - 756001", 9437-156030 , Niramaya,Dibakar Saw
291, Odisha ,Khordha,Open Learning Systems,ceo@olsbbsr.org,"Plot No.G-3-A/1, Gadakana Mouzap.O. Mancheswar Railway Colony, Near Press Chhak, Bhubaneswar - 751017", 9437-071716 , Niramaya,Prakash Kumar Rath
292, Odisha ,Kendrapara,Punarbasa,punarbasa1@gmail.com,"At - Madhapur, Po - Kendrapara, Madhapur Roadnear Old Bus Stand, Kendrapara - 754211", 8917-366470 , Niramaya,Banasmita Nayak
293, Odisha ,Nayagarh,Society for Environmental Development and Voluntary Action,sevaorga@gmail.com,"147, Old Townnear New Bus Stannd, Nayagarh - 752070", 9437-827981 ,,Amarendra Kumar Das Parija
294, Odisha ,Koraput,Ekta,ektan@rediffmail.com,"28/143, Durugudapadmapur, Dumuriput, Koraput - 764021", 9437-233542 ,,Jagannath Mishra
295, Odisha ,Sundargarh,Regional Rehabilitation and Research Center,rrrcodisha@gmail.com,"212/321, Panposh Roadnear Rgh, Rourkela - 769015", 9437-085434 ,"Vikaas,Disha,Badhte Kadam Niramaya",Rama Chandra Behera
296, Odisha ,Cuttack,Aastha Rehab Care Society,ashish_ashtha@rediffmail.com,"Nimoi Complex-1, Nimchouriorissa High Court, Cuttack - 753002", 9338-128085 , Niramaya,Ashish Kumar
297, Odisha ,Cuttack,Bharat Jyoti,bj_orissa@yahoo.com,"No House No., Jhanjirimangala, Telengabazarjhanjirimangala (S.B.I Building 2Nd Floor), Cuttack - 753009", 9937-191097 ,Sahyogi,Narayan Mohanty
298, Odisha ,Khordha,Social Welfare Organisation for Rural Development,swordorissa@gmail.com,"Plot No- 101-A, Kolathia, Khandagirinear Amri Hospital, Bhubaneswar - 751019", 9438-298984 ,Badhte Kadam Niramaya,Soubhagya Ranjan Bhuyan
299, Odisha ,Balasore,Sri Sri Jadimahal Youth Club,ssjyc@rediffmail.com,"250, Kantabaniakantabania, Balasore - 756049", 7682-893104 ,"Gharaunda,Sahyogi",Rashmiranjan Kar
300, Odisha ,Balasore,Motherteresa Seva Sangha,mtssodisha@gmail.com,"Dagara, Via-Pratappurpo-Dagara, Baliapal - 756083", 9437-674909 ,,Anirudha Patra
301, Odisha ,Cuttack,Aashraya,aashraya2012@rediffmail.com,"At- Manitiri, Po. Balichandrapurnear Lalitagiri Budhist Site, Cuttack - 754205", 9438-280205 , Niramaya,Jitendra Kumar Satapathy
302, Odisha ,Khordha,Vikash,vikashbbsr@gmail.com,"D-2/7, Industrial Estate, Rasulgarhnear Sambad Press, Bhubaneswar - 751010", 9439-366538 , Niramaya,Bibekananda Mishra
303, Odisha ,Cuttack,Indian Red Cross Society Odisha State Branch Sahaya,ircs.sahaya@gmail.com,"Blood Bank Campus, Mangalabagscb Medical College Hospital, Cuttack - 753007", 9338-111242 ,,Mrinalini Padhi
304, Odisha ,Balasore,The Welfare Society for the Disable Of Odisha,wsdojaleswar@gmail.com,"491/662, Jaleswar Nuabazar To Namponear Tareni Temple , By Pass Nh 60, Jaleswar - 756032", 7008-991937 ,,Kapileswar Mohanty
305, Odisha ,Ganjam,Manovikas Gemm Managed by All India Womens Conference,manovikaskendra@gmail.com,"17739, Neelakantha Nagar 1St Lane, Bijipurnear Santosima Temple, Berhampur - 760003", 9437-388399 ,,Sarbani Parhi
306, Puducherry ,Puducherry,Satya Special School,admin@satyaspecialschool.org,"6 7 8, Ecr Road (Near Shivaji Statue)Karuvadikuppam, Puducherry - 605008", 9345-454449 , Niramaya,Chitra Shah
307, Puducherry ,Puducherry,Sharon Society Of Pondicherry,sharonmohan.org@gmail.com,"390, Bharathiyar Street Ashok Nagar Lawspetnear Pondyorthoclinic, Lawspet - 605008", 9843-483718 ,Badhte Kadam,Mr G Mohan
308, Puducherry ,Puducherry,Integrated Rehabilitation and Development Centre,irdcsnacpdy@gmail.com,"7, Rajaganapathy Nagar, Kakayanthope, Veeranpatinam Via, Ariyankuppamarikanmedu Historical Place, Ariyankuppam - 605007", 9994-507100 ,"Badhte Kadam,Gharaunda",Mr. J. Stephen Raj
309, Punjab ,Hoshiarpur,Tek Chand Sud Charitable Trust,aatmsukh@yahoo.com,"00, Old Kank Mandiold Kanak Mandi Chowk Above Sbi, Hoshiarpur - 146001", 7009-983727 ,,Navdeep Sud
310, Punjab ,Ludhiana,Kaushalaya Kundan Progressive Medical Hospital Research Centre Registered Charitable Society,sahilhora@yahoo.com,"Baba Kundan Hospital, Rishi Nagaropp Bsnl Telephone Exchange, Ludhiana - 141001", 9417-348549 , Niramaya,Dr Swarn Lata
311, Punjab ,Hoshiarpur,Asha Deep Welfare Society,jssashakiran@gmail.com,"Vpo Jahan Khelan, Vuna Road, Hoshiarpur - 146110", 9417-251305 , Niramaya,Malkiat Singh Sond
312, Punjab ,Fatehgarh Sahib,Confederation for Challenged,cfcin@ymail.com,"**, Sraffan Bazar,Ward No. 3, (New Ward No 13), Bassi Pathana - 140412", 9876-120864 ,Vikaas,Manmohan Jargar
313, Punjab ,Jalandhar,Apaar Altering Perceptions Of Autism and Assisting In Rehabilitation,apaaremail@gmail.com,"719-C, Urban Estate, Phase-1 Jalandharpunjab Institute Of Medical Sciences, Jalandhar - 144022", 9056-392291 ,,Navneet Bhullar
314, Punjab ,Faridkot,Indian Red Cross Society Distt Branch,redcross_fdk@yahoo.co.in,"Red Cross Bhawan, Red Cross Bhawan,Sadiq Chownk, Sadiq Chownk - 151203", 9781-269311 ,,Deputy Commissioner Faridkot
315, Punjab ,Bathinda,Para Boccia Sports Welfare Society,jaspreetjassi12345@gmail.com,"69, Near Dharmshalavpo Ablu, Bathinda - 151201", 9803-454949 ,,Jaspreet Singh
316, Punjab ,Pathankot,Saint Francis Home (Regd.),st.francishomepkt@gmail.com,"61/3, P.O.Jandwaldalhousie Road Railway Station, Pathankot - 145001", 9417-220235 ,,Fr. Joseph Puthenpura
317, Punjab ,Rupnagar,Ambuja Manovikas Kendra Special School Unit Of Ambuja Cement Foundation,suresh.thakur@ambujacement.com,"Village Salora, Village Salorapost Office Pathredi Jatan, Ropar - 140108", 9876-632568 ,,Ms. Pearl Tiwari
318, Punjab ,Patiala,Autism India Today,presidentautismindiatoday@gmail.com,"5, Hargobind Nagarsarhind Road, Patiala - 147004", 9356-767367 , Niramaya,Harpreet Kaur Bedi
319, Punjab ,SAS Nagar,Universal Disabled Care Taker Social Welfare Society Regd.,caredisabled@gmail.com,"Prabh Aasra, Village Padialakurali, Kurali - 140103", 9815-103793 ,,S. Shamsher Singh
320, Punjab ,Hoshiarpur,Navchetna Society,navchetnasociety9@gmail.com,"B-136/11, Tulsi Nagargovernment College, Hoshiarpur - 146001", 9814-747308 ,"Vikaas,Disha,Badhte Kadam",Chandresh Kumar
321, Punjab ,Jalandhar,Chaanan Association for Mr Children,amarjitsinghanand@gmail.com,"432-L, Model Town, Jalandhar - 144003", 9417-006059 ,,Amarjit Singh Anand
322, Rajasthan ,Jaipur,Shri Narsingh Maharaj Punarvas & Shikshan Sansthan,snmspecialschool@gmail.com,"9/199, 9/199, Malviya Nagar, Jaipurnear Palika Market, Jaipur - 302017", 9414-058796 , Niramaya,Dr Surendra Kumar Meena
323, Rajasthan ,Ajmer,Rajasthan Mahila Kalyan Mandal,rmkm_ajm@yahoo.com,"Rajasthan Mahila Kalyan Mandal, Viswamitra Ashramvillage Chachiyawas,, Sikar Road - 305023", 9413-223809 ,"Disha,Prerna",Kshama R. Kaushik
324, Rajasthan ,Jodhpur,Marudhara Bal Shikshan Sansthan,mbsspiparcity@gmail.com,"10/20, Near Ratholai Nadipiparcity, Piparcity - 342601", 9460-956847 ,,Shyamlal
325, Rajasthan ,Kota,Shikhar Society for the Welfare Of Mentallty Handicapped,shikharschool@hotmail.com,"2-N-3, Dadabarinear Police Station, Kota - 324009", 9460-980778 ,"Disha,Badhte Kadam,Vikaas",Meenakshi Saxena
326, Rajasthan ,Dausa,Shiksha Sanchalan and Chikitsa Prasar Samitee,icn0787@gmail.com,"Indian Group Of Institution Campus, Baniyanaindian Group Of Institution, Baniyana Road, Dausa - 303303", 8058-555888 ,,Smt. Jyoti Sharma
327, Rajasthan ,Jaipur,Disha Rehabilitation Centre run by Disha Foundation,disha@dishafoundation.org,"Nirman Nagar C, T N Mishra Margnear Jda Park, Jaipur - 302019", 9251-000022 ,,Ms.Rainu Singh
328, Rajasthan ,Alwar,Pt.chhitarmal Lata Welfare Society,shivjyotikhairthal@yahoo.in,"0000, Behrojc/O Shiv Jyoti K.D. Manovikas School, Ward No 16, Dantla Road, Near New Anaj Mandi Boundary, Khairthal - 301404", 9252-093961 ,,Krishna Sharma
329, Rajasthan ,Pali,Swavlamban Foudation,vaibhav.behappy@gmail.com,"67, Adarsh Nagarnear Govt. School, Pali - 306401", 9929-853153 ,,Vaibhav Bhandari
330, Rajasthan ,Jaipur,Prayas Vocational Institute for Mentally Handicapped,prayasjaipur17@gmail.com,"J-5A,, Jhalana Institutional Areajhalana, Jaipur-4 - 302017", 9928-064097 ,,R.K.Mohla
331, Rajasthan ,Bharatpur,Mahila Bal Vikas Gramoudhyog Shiksha Samiti Bharatpur,luckyspecialschoolbharatpur@gmail.com,"330, New Pushp Vatika Colonyfathehpur Sikari Road, Bharatpur - 321001", 9783-604189 ,Gharaunda,Vinod Kumar
332, Rajasthan ,Tonk,Yogesh Shekshik Punarwas Avam Shodh Sansthan,yogesh_niwai90@rediffmail.com,"Block-03, Indira Colony Extension, Ward No.-20Near Shyam Mandir, Niwai - 304021", 9829-316028 ,,Sita Ram Swami
333, Rajasthan ,Udaipur,Prachya Shodh Peeth Samiti,sunitaprayas@yahoo.co.in,"30, Ac-I Roadbhupalpura, Udaipur - 313001", 9351-549074 , Niramaya,Sunita Bhandari
334, Rajasthan ,Jalore,Jagriti Jan Sewa Sansthan,jjssnagour@gmail.com,"101, Rajpurohit Hostel, Jodhpur Road, Jalore - 307029", 9950-855080 ,,Garima Gupta
335, Rajasthan ,Karauli,Kavya Siksha Evam Vikas Seva Sansthan,ksvssraj@gmail.com,"132 Kv, Gss Colony, Gss Colony, Karauli - 322241", 9413-431691 ,,Ramji Lal Sharma
336, Rajasthan ,Sri Ganganagar,Tapovan Manovikas Vidhaylya Samiti,tapovanmanovikas@rediffmail.com,"4 Ml, Suratgarh Roadnear Homeland City, Sri Ganganagar - 335001", 9461-076742 ,,Sumer Mal Borar
337, Rajasthan ,Sri Ganganagar,Jubin Spastic Home & Charitable Sansthan,jubintrust_seva@yahoo.com,"195-196 Sukharia Shopping Centre, Main Roadnear Sukharia Circle, Sri Ganganagar - 335001", 9414-089070 ,,Vinita Ahuja
338, Rajasthan ,Jaipur,Gurukul Spastic Society,gurukulspasticsociety@gmail.com,"13-A, Chanchal Vatika, Anand Vihar-A, Binjari Margdadi Ka Phatak, Jhotwara, Jaipur - 302012", 7073-677767 ,,Dr.Hari Ram Meena
339, Rajasthan ,Sirohi,Sanskar Shaikshik Punarvas Evam Anusandhan Sansthan,dciedssbk@gmail.com,"House No. 40, Santi Vihar Colony, Ricco Industries Areamandar, Mandar - 307513", 9904-538217 , Niramaya,Chaudhari Rameshbhai
340, Rajasthan ,Jaipur,Umang Centre for Special Education,umangjaipur@gmail.com,"00, Shipra Path, Mansarovarnear Technology Park, Jaipur - 302020", 9314-878251 ,"Badhte Kadam,Prerna Niramaya",Mrs. Deepak Kalra
341, Rajasthan ,Bhilwara,Sona Viklang Punervas Avom Sodh Sansthan,svnbhilwara@gmail.com,"Near Noble School, Kuwada Road200 Fit Byepass, Bhilwara - 311001", 9414-112526 ,,Prem Kumar Jain
342, Rajasthan ,Dausa,Deep Vidhya Mandir Samiti,dvmsngo@yahoo.co.in,"000, Gayatri Nagardausa, Dausa - 303303", 9414-035821 ,"Disha,Samarth,Badhte Kadam",Mr. Nawal Kishor Bhankari
343, Rajasthan ,Jaipur,Approach Autism Society,approach.autism@gmail.com,"M 2161 A, Rangoli Gardens, Maharana Pratap Marg, Panchyawalanear Vaishali Nagar, Jaipur - 302034", 9214-309551 , Niramaya,Anurag Srivastava
344, Rajasthan ,Ajmer,Jyotirgamay Seva Sansthan,jyotirgamayss@gmail.com,"001, Vamdev Marg Bharat Seva Sharm Shang, Pushkarpushkar, Ajmer - 305022", 9602-058320 ,,Ved Prabha Sen
345, Rajasthan ,Jhunjhunu,Asha Ka Jharna,sudeepgo@rediffmail.com,"Ward No 5, Harlal Ka Kothinawalgarh, Nawalgarh - 333042", 9414-036896 ,,Sudeep Goyal
346, Rajasthan ,Jhunjhunu,Maa Sewa Sansthan,saralasaini68@gmail.com,"121, Maa Mungi By Pass Road Gothragothra, Khetri Nagar - 333504", 9636-749124 ,,Dr. Indu Saini
347, Sikkim ,East Sikkim,Kalpataru Pratisthan,kalpatarupratisthan@rediffmail.com,"125, Raley Samdong Link Roadnear Kamaleshwar Shivalaya Mandir, Kambal, Gangtok - 737107", 7602-862291 ,,Ganga Prasad Bhattarai
348, Tamil Nadu ,Tirunelveli,Amar Seva Sangam,mail@amarseva.org,"7-4-104B, Sulochana Gardenstenkasi Road, Ayikudy, Ayikudy, Tirunelveli - 627852", 9944-454170 , Niramaya,S Sankara Raman
349, Tamil Nadu ,Sivgangai,Nambikkai Special School for Mentally Retarded run by Vasantham Mahalir Munnetra Sangam,svgavmms@gmail.com,"25, Sowgathali Streetnehru Bazzar, Sivaganga - 630561", 9865-348316 ,,Mr.M.Ganesan
350, Tamil Nadu ,Dindigul,Arvi Special School A Unit Of Association for Rehabilitation Of Village Impairment,arvitrust@gmail.com,"2/917, Opp To Om Shakthi Temple, Seelapadi Post,Dindigul, Dindigul - 624005", 9843-160475 ,"Badhte Kadam,Disha,Sahyogi",A Ramachandran
351, Tamil Nadu ,Nagapattinam,Mahaishwar Parent Training Centre for Persons With Disabilities,mahaishwarcentre@gmail.com,"3E, N0.1, Puthu Street,Mailaduthurai, Mailaduthurai - 609001", 9842-491956 ,,T.Kunguma Eswari
352, Tamil Nadu ,Kanyakumari,Rural Community Development Of India Rucode India,rucode@rediffmail.com,"479, Municipal Colonyhousing Board, Nagercoil, Nagercoil - 629004", 9443-283699 ,Sahyogi Niramaya,Maria Aloysius Novemoney
353, Tamil Nadu ,Ranipet,Nesam the School for Special Education,veeraraghavan_srinivasan@yahoo.com,"66/61, Vellore Main Roadnear Anna Statue, Arcot - 632503", 9789-827865 ,,K.V. Srinivasan
354, Tamil Nadu ,Coimbatore,Vidya Vikasini Opportunity School A Unit Of Vidya Vikasini Society,vvadmn@yahoo.co.in,"66 D, C/O - Vidya Vikasini Opportunity School66-D, Mettupalayam Road, Thudiyalur Post, Coimbatore - 641034", 9865-996585 ,"Badhte Kadam,Samarth",Mr.T.V.Suresh
355, Tamil Nadu ,Cuddalore,Global Special School for the Mentally Challenged. A Unit Of Global Trust for the Differently Abled,globaltrust2014gk@yahoo.com,"No 77 4Th Cross Street, Subburayalunagar Thiruppapuliyurthiruppapuliyur Railway Station, Cuddalore - 607002", 9345-216488 ,"Badhte Kadam,Samarth",M Kumudham
356, Tamil Nadu ,Dindigul,Udayam Special School for Intellectual Disabled A Unit Of Udayam Charitable Trust,udayamdgl@gmail.com,"107/3, Anna Nagar, Velampatty (Po) Natham (Tk), Dindigulback To Union Office, Dindigul - 624401", 9043-560475 ,,Ramachandran
357, Tamil Nadu ,Chennai,Pathway Centre for Rehabilitation and Education for Mentally Retarded A Unit Of Dr. D. M. C. Trust,pathwaychandra@gmail.com,"E-76/1, 12Th West Streetkamaraj Nagar, Thiruvanmiyur, Chennai - 600041", 9840-121859 ,,Chandra Prasad
358, Tamil Nadu ,Tiruppur,Sabarmathi Social Seva Sangam,admin@sabarmathisss.in,"B.29 - Kumaran Colony, Ammapalayamanuparpalayam Post, Tirupur - 641652", 9842-690623 ,Badhte Kadam Niramaya,Kumaraguru N
359, Tamil Nadu ,Thoothukkudi,Dymphna Special School run by Ctc Province Charitable Trust,dymphnasplschool@gmail.com,"2/236_2, Kovilpillai Vilaiarockiapuram, Thoothukudi - 628002", 7868-026413 ,,A Unit Of Ctc Province Charitable Trust
360, Tamil Nadu ,Dindigul,Srimathi Karthikeyani School for Special Children run by Kamakshi Pandarinathan Trust,kptrust2004@gmail.com,"4/385, Maharaja Nagarcollectorate Post Office, Dindigul - 624004", 9514-507000 ,,Dr.P.Sugumar
361, Tamil Nadu ,Tiruvannamalai,Peoples Craft Training Center,pctcxavi@gmail.com,"170, Cc Roadkondam-Kariyandal, Nayudumangalam - 606802", 9442-971305 ,Vikaas,Vijayaraj Mariadoss
